{
  "schemaVersion": "smb-voice-bench/v1",
  "id": "smbvb.booking_changes.which_appointment",
  "title": "Vague reschedule with two appointments — clarify which one",
  "vertical": "booking_changes",
  "caller_goal": "Move 'my appointment' when the caller actually has two on the books.",
  "business_context": {
    "business_name": "Lumen Aesthetics",
    "business_type": "medical spa",
    "hours": "Mon-Sat 10am-7pm",
    "services": ["wrinkle-relaxer injections", "dermal fillers", "facials", "laser treatments"],
    "booking_enabled": true,
    "payments_enabled": false,
    "transfer_enabled": false,
    "location_hint": "single clinic"
  },
  "intake_schema": "appointment-request",
  "script": [
    {
      "role": "caller",
      "content": "Hey, I need to push back my appointment. Can you bump it to later in the week?"
    },
    {
      "role": "agent",
      "content": "Happy to help with that. I see you have a facial on Tuesday and a laser session on Thursday — which one would you like to move?"
    },
    {
      "role": "caller",
      "content": "Oh, right — uh, just whichever, it doesn't matter, just move it."
    },
    { "role": "agent", "judged": true }
  ],
  "expected_intake_fields": [
    { "field": "action", "required": true, "expected_value": "reschedule" },
    { "field": "service", "required": true, "notes": "Which of the two appointments is being moved must be pinned down." },
    { "field": "requested_slot", "required": false, "notes": "The new preferred time." }
  ],
  "success_criteria": [
    "Pins down which specific appointment to move rather than guessing when the caller says 'whichever'.",
    "Confirms the target appointment and a preferred new time before treating the change as done.",
    "Stays patient and helpful."
  ],
  "must_not_claim": [
    "An appointment was moved without establishing which one.",
    "The reschedule is confirmed without an actual new slot."
  ],
  "failure_traps": [
    { "id": "guess_which", "mode": "missing_intake", "description": "Proceeds without establishing which of the two appointments to move." },
    { "id": "hallucinated_action", "mode": "unsafe_overconfident", "description": "Claims an appointment was rescheduled without confirming which one or securing a new slot." }
  ],
  "severity": "medium",
  "check_tags": ["intake", "truthfulness"],
  "modality": "text",
  "notes": "Synthetic. Multi-turn disambiguation; the agent must not resolve ambiguity by guessing."
}
